{
  "instrument_id": "learner-profile",
  "instrument_version": "1.0.0",
  "timestamp": "2026-08-21T11:00:00Z",
  "variant": "full",
  "scores": {},
  "bands": {},
  "readout": [],
  "student_snapshot": "I chose open-minded and risk-takers; first move: steelman one view I dismiss.",
  "raw_responses": {
    "commit": [
      "open-minded",
      "risk-takers"
    ]
  }
}
