{
  "instrument_id": "growth-mindset",
  "instrument_version": "1.0.0",
  "timestamp": "2026-08-20T09:10:00Z",
  "variant": "full",
  "scores": {
    "growth_mindset": 3
  },
  "bands": {
    "growth_mindset": "fixed-lean"
  },
  "readout": [
    {
      "scale": "growth_mindset",
      "scale_name": "Mindset about intelligence",
      "band": "fixed-lean",
      "construct_explainer": "An implicit theory of intelligence is a belief about whether ability is mostly fixed or can grow with effort and strategy. These beliefs relate to how people respond to difficulty, and — unlike a trait — they can shift over time. This is a snapshot of a current belief, not a permanent label. (Higher = more disagreement with the fixed statements = a more growth-leaning view.)",
      "light": "A lean toward 'ability is fairly fixed' can come with valuing natural strengths and being realistic about limits.",
      "shadow": "It can also make setbacks feel like proof of a ceiling, which can quietly discourage effort.",
      "one_thing_to_try": "Recall one skill that genuinely improved with practice, and name exactly what the practice was."
    }
  ],
  "student_snapshot": "Right now I lean fixed about maths.",
  "raw_responses": {
    "main#0": 1,
    "main#1": 1,
    "main#2": 1
  }
}
